{
  "$schema": "platform-support-matrix.schema.json",
  "schemaVersion": 1,
  "matrixId": "hxc-tier1-v1",
  "authority": "docs/adr/0007-strict-c11-target-and-platform-baseline.md",
  "releaseBlocking": true,
  "lanes": [
    {
      "id": "linux-x86_64-gcc",
      "tier": 1,
      "runner": "ubuntu-24.04",
      "os": "linux",
      "environment": "hosted",
      "architecture": "x86_64",
      "toolchain": "gcc",
      "profile": "portable",
      "runtimePolicy": "auto",
      "execution": "native",
      "evidence": ["native-compile", "native-link", "native-run", "sanitizer", "c-consumer", "cpp-consumer"],
      "artifactKinds": ["executable"]
    },
    {
      "id": "linux-x86_64-clang",
      "tier": 1,
      "runner": "ubuntu-24.04",
      "os": "linux",
      "environment": "hosted",
      "architecture": "x86_64",
      "toolchain": "clang",
      "profile": "portable",
      "runtimePolicy": "auto",
      "execution": "native",
      "evidence": ["native-compile", "native-link", "native-run", "sanitizer", "c-consumer", "cpp-consumer"],
      "artifactKinds": ["executable"]
    },
    {
      "id": "linux-aarch64-gcc",
      "tier": 1,
      "runner": "ubuntu-24.04-arm",
      "os": "linux",
      "environment": "hosted",
      "architecture": "aarch64",
      "toolchain": "gcc",
      "profile": "portable",
      "runtimePolicy": "auto",
      "execution": "native",
      "evidence": ["native-compile", "native-link", "native-run", "sanitizer", "c-consumer", "cpp-consumer"],
      "artifactKinds": ["executable"]
    },
    {
      "id": "linux-aarch64-clang",
      "tier": 1,
      "runner": "ubuntu-24.04-arm",
      "os": "linux",
      "environment": "hosted",
      "architecture": "aarch64",
      "toolchain": "clang",
      "profile": "portable",
      "runtimePolicy": "auto",
      "execution": "native",
      "evidence": ["native-compile", "native-link", "native-run", "sanitizer", "c-consumer", "cpp-consumer"],
      "artifactKinds": ["executable"]
    },
    {
      "id": "macos-arm64-apple-clang",
      "tier": 1,
      "runner": "macos-15",
      "os": "macos",
      "environment": "hosted",
      "architecture": "arm64",
      "toolchain": "clang",
      "profile": "portable",
      "runtimePolicy": "auto",
      "execution": "native",
      "evidence": ["native-compile", "native-link", "native-run", "c-consumer", "cpp-consumer"],
      "artifactKinds": ["executable"]
    },
    {
      "id": "macos-x86_64-apple-clang",
      "tier": 1,
      "runner": "macos-15-intel",
      "os": "macos",
      "environment": "hosted",
      "architecture": "x86_64",
      "toolchain": "clang",
      "profile": "portable",
      "runtimePolicy": "auto",
      "execution": "native",
      "evidence": ["native-compile", "native-link", "native-run", "c-consumer", "cpp-consumer"],
      "artifactKinds": ["executable"]
    },
    {
      "id": "windows-x86_64-clang-cl",
      "tier": 1,
      "runner": "windows-2025",
      "os": "windows",
      "environment": "hosted",
      "architecture": "x86_64",
      "toolchain": "clang-cl",
      "profile": "portable",
      "runtimePolicy": "auto",
      "execution": "native",
      "evidence": ["native-compile", "native-link", "native-run", "c-consumer", "cpp-consumer", "static-library", "dynamic-library"],
      "artifactKinds": ["executable", "static-library", "dynamic-library"]
    },
    {
      "id": "cortex-m3-arm-none-eabi-gcc",
      "tier": 1,
      "runner": "ubuntu-24.04",
      "os": "bare-metal",
      "environment": "freestanding",
      "architecture": "armv7-m",
      "toolchain": "arm-none-eabi-gcc",
      "profile": "metal",
      "runtimePolicy": "minimal",
      "execution": "emulated",
      "evidence": ["cross-compile", "cross-link", "map-symbol-inspection", "emulated-run"],
      "artifactKinds": ["executable", "map"]
    }
  ]
}
